Sheet: Review
A1: OpenETCS Review Sheet
A3: Work Package | B3: WP2
A4: Deliverable ID | B4: D2.4
A6: Document title | B6: OpenETCS methods
A7: Document version | B7: 00.01
A8: Document author(s) | B8: David Mentré, Marielle Petit-Doche and Matthias Güdemann
A9: Organisation | B9: Systerel
A10: Document approbation | B10: Gilles Delmas
A12: Review opening date | B12: 2013-05-03T00:00:00.000
A13: Review closing date | B13: 2013-05-18T00:00:00.000
A15: Reviewer's name | B15: Organisation | C15: Initials | E15: Explanations:
A16: Sylvain Baro | B16: SNCF | C16: SBA | E16: Review: main sheet providing the document and review information.
A17: Bernd Hekele, Baseliyos Jacob, Klaus-Rüdiger Hase | B17: DB | C17: BH | E17: Comments: detailed comments and the answer provided
A18: Hardi Hungar | B18: DLR | C18: HH | E18: Main Issues: main/open issues on the document after review
A19: Jan Welte | B19: TU Braunschweig (TU-BS) | C19: jw

Sheet: Comments
A1: Comments
A3: # | B3: Reviewer | C3: Page/§/Req. | D3: Maj/Min/Q | E3: Comment | F3: Answer | G3: OK/NOK/OPEN
A4: 1 | B4: SBA | C4: 4.1 | D4: Min | E4: This is just quibbling, but I don't think that the syntax defines how the system is described. The syntax only defines how the description is built and valid. IMHO this is the semantics that defines what means the description (therefore how the system is described). The semantics can be informal (AND means "the usual and"), or formal (via truth table, or boolean and, or product in Z/2Z...) | F4: Agree, bad wording. Rephrased as follow: "The syntax defines how the system or software description is built and valid." | G4: OK
A5: =R[-1]C+1 -> 2 | B5: SBA | C5: 4.1 | D5: Min | E5: Again, just quibbling... but the semantics does not "describe how the system evolves along time": it maps some objects (numbers, values, operators) on some other objects. The semantics must be preserved through the evaluation of the operators (or it is pretty useless), but it can be completely static (a type system is a semantics ; we can give a semantics to a declarative language such as propositional calculus). | F5: Agree, bad wording. Rephrased for semantics: "The semantics gives a meaning to each object found in the system or software description. This meaning is given using a mathematical model, i.e., use of mathematical objects attached to each element of the syntax and mathematical rules that define how those objects interacts with other objects." | G5: OK
A6: =R[-1]C+1 -> 3 | B6: SBA | C6: 4.1 | D6: Maj | E6: I think it should be clarified here if being able to compile/run is sufficient to claim being formal, or not. After all, any programming language is formal, and have a semantics (could be the machine code, or the execution trace). It is important to be clear on this topic, because the subject has already being raised, and I bet that it will be raised again. | F6: OK. Added following paragraph "One should notice that being able to compile or run a language is not enough to give it some semantics, as this semantics is hidden within the execution/compilation steps. An explicit document should be provided. This document can be informal (e.g. the B-Book) or formal (BiCoq formalization of B Method in Coq formal language)." | G6: OK
A7: =R[-1]C+1 -> 4 | B7: BH | C7: 7/§4.4 | D7: Maj | E7: We see the benefit of easy extensions in the requirements as another advantage. The model can be extended as well and most of the Formal Methods should be available by inheritance. Please, add a section on this. | F7: OK. Added following paragraph "The fourth benefit is the ability to easily extend the formalized system or software, by updating the formal description. After such an update, applying the formal verification allows to know precisely which parts are no longer valid and focus development e ort on them, without the need to re-verify parts not impacted by the change." | G7: OK
A8: =R[-1]C+1 -> 5 | B8: BH | C8: 7/§4.5 , bullets | D8: Maj | E8: The "Specification of Requirements" (as we intend to do) is another step in the cycle worth mentioning as a first bullet. | F8: OK. Added bullet "Formalization of Requirements" and following paragraph: "In the System Development Phase and Software Requirements Phase, a formal approach applied to initial requirements can bring clarifications, by enforcing a non-ambiguous meaning for all parties. In case making such a formalization of requirements is difficult, it usually triggers further clarification efforts between involved parties." | G8: OK
A9: =R[-1]C+1 -> 6 | B9: BH | C9: General | D9: Maj | E9: We miss the classification of our investigated tools in the document. You should indicate e.g., in which phase the tool can be used and the method supported by the tool. Some tools are missing in your investigation, e.g., ERTMS Solutions, Papyrus,. This level of information should be available now after having had the workshops. | F9: Is it the purpose of this document? | G9: OPEN
A10: =R[-1]C+1 -> 7 | B10: HH | C10: 9 / 5.2 | D10: Min | E10: In practice, model checking is combined with other techniques, most prominently abstraction and decomposition. And it is applied also to programs.
A11: =R[-1]C+1 -> 8 | B11: HH | C11: 9 / 5.3 | D11: Q | E11: I think soundness means that if no issues are found in the abstract domain, then there are no issues in the (concrete) program.
A12: =R[-1]C+1 -> 9 | B12: HH | C12: 10 / 6.2 | D12: Min | E12: In my opinion, we should introduce precise definitions of "verification" and "validation". My proposal, to be as consistent as possible with the wording of the standards, is to use "verification" for the activity which checks whether the output of a design step meets its objectives, usually that the output of the step implements/refines the input. "validation" checks whether the outcome of the whole process meets the initial requirements. It might be advisable to generalize this latter to checks which span more than one design step, e.g. check whether a formal model captures the initial requirements (in its design context, thus taking descriptions of neighboring components into account. Cf. the document on "Evaluation Criteria for Verification and Validation Tools".
A13: =R[-1]C+1 -> 10 | B13: jw | C13: 6 | D13: min | E13: As I have presented in D2.1 (page 2f.) we have a slightly extended definition of formal, which names 3 parts: first we name (i) completely defined set of symbols, the other two are the same as yours (ii) rigorous (in our definition mathematically defined to be unambiguous, complete and consistent) syntax, (iii) rigorous (in our definition mathematically defined to be unambiguous, complete and consistent) semantics; since I see no conflict with your description, we should probably add the set ob symbols, too.
A14: =R[-1]C+1 -> 11 | B14: jw | C14: 7 | D14: Q | E14: Since "Correct by Construction" is used as a concept name it should be shortly explained and at all point be writen in the same way (capital letter)
A15: =R[-1]C+1 -> 12 | B15: jw | C15: 8 | D15: Q | E15: For logical reasons the methods named in the itemization t the beginning of chapter 5 should be identical with the section headlines
A16: =R[-1]C+1 -> 13 | B16: jw | C16: 9 | D16: Maj | E16: "… three kinds of formal methods can be used for the design and development of a system" I understand your point, but the formulation sounds like these are the only "formal design methods" which can be used. From my point of view these are more the different verification (and validation) methods, which can be applied using different formal means of description for design and development. (granted this isn't a good formulation, too)
A17: =R[-1]C+1 -> 14 | B17: jw | C17: All | D17: Maj | E17: Definition what is a formal method and whats a formal approach is not clear in the document. Both terms get mixed. Using only the term fromal approach (as mainly down) and reffering to methods using formal means of description.

Sheet: Main Issues
A1: Main/Open Issues
A3: # | B3: Title | C3: Description | D3: Proposal | E3: Status